{
  "schema_version": "xrai.eval.local.v1",
  "task_id": "D0-TJ-04",
  "family": "TSJS",
  "run_kind": "scripted_retrieval",
  "adapter": "selective-grep-v1",
  "model": null,
  "tokenizer": null,
  "usage": null,
  "financial_cost": null,
  "outcome": "not_judged",
  "setup_seconds": 0.002735165999183664,
  "permission_policy": "workspace_only_no_network",
  "environment": {
    "system": "Darwin",
    "release": "27.0.0",
    "machine": "arm64",
    "python": "3.15.0",
    "executor_sha256": "a96a139174041ae8dfe7963efb7acd8c1ff59a39e1f8a5bd857f76274fc65660"
  },
  "input_sha256": "e229b748fab18b98b507f2c99118a56819141c66a631c4cadde1cf5bcbac5d33",
  "rounds": [
    {
      "phase": "inventory",
      "command": [
        "/usr/bin/find",
        ".",
        "-type",
        "f"
      ],
      "status": "ok",
      "exit_code": 0,
      "sandbox": "macOS Seatbelt",
      "diagnostic": null,
      "elapsed_seconds": 0.00796641700071632,
      "stdout": {
        "base64": "Li9saWNlbnNlLm1kCi4vaW5kZXguanMKLi8ubnBtcmMKLi90ZXN0cy5qcwouLy5naXRpZ25vcmUKLi9wYWNrYWdlLWxvY2suanNvbgouL3BhY2thZ2UuanNvbgouLy5naXRodWIvd29ya2Zsb3dzL2NpLnltbAouL3Byb2JlLmpzCg==",
        "sha256": "d5417c5667c03314853fd2df4fe51853e444f483abb4bdc95d92a6a8bca5e39f",
        "captured_bytes": 130,
        "observed_bytes": 130,
        "truncated": false
      },
      "stderr": {
        "base64": "",
        "sha256": "e3b0c44298fc1c149afbf4c8996fb92427ae41e4649b934ca495991b7852b855",
        "captured_bytes": 0,
        "observed_bytes": 0,
        "truncated": false
      }
    },
    {
      "phase": "selective_reading",
      "command": [
        "/usr/bin/grep",
        "-R",
        "-n",
        "-I",
        "-i",
        "-m",
        "3",
        "-C",
        "3",
        "-E",
        "--include=*.rs",
        "--include=*.ts",
        "--include=*.tsx",
        "--include=*.js",
        "--include=*.jsx",
        "--include=*.py",
        "--include=*.go",
        "--exclude-dir=.git",
        "Após|criar|probe|remover|readme|probe|revisão|atual|reporte|readme|não|existe",
        "."
      ],
      "status": "error",
      "exit_code": 1,
      "sandbox": "macOS Seatbelt",
      "diagnostic": null,
      "elapsed_seconds": 0.008849000001646345,
      "stdout": {
        "base64": "",
        "sha256": "e3b0c44298fc1c149afbf4c8996fb92427ae41e4649b934ca495991b7852b855",
        "captured_bytes": 0,
        "observed_bytes": 0,
        "truncated": false
      },
      "stderr": {
        "base64": "",
        "sha256": "e3b0c44298fc1c149afbf4c8996fb92427ae41e4649b934ca495991b7852b855",
        "captured_bytes": 0,
        "observed_bytes": 0,
        "truncated": false
      }
    }
  ],
  "measurement": {
    "captured_bytes": 130,
    "model_tokens": null
  },
  "limitations": [
    "scripted retrieval; no agent success or competitive advantage measured",
    "no model tokenizer configured; token counts and model costs unknown"
  ],
  "transcript_sha256": "d652e26a0ac9c7143cad043b77f849eb2baedda94fb2f540e61b298f930701f5",
  "workspace_sha256": "34eff78e1ac9eeddbd53474ef48460612abfaee1e34737acb01a7977a57d2b30"
}
