{
  "schema_version": "xrai.eval.local.v1",
  "task_id": "D0-RS-05",
  "family": "Rust",
  "run_kind": "scripted_retrieval",
  "adapter": "selective-grep-v1",
  "model": null,
  "tokenizer": null,
  "usage": null,
  "financial_cost": null,
  "outcome": "not_judged",
  "setup_seconds": 0.002436334001686191,
  "permission_policy": "workspace_only_no_network",
  "environment": {
    "system": "Darwin",
    "release": "27.0.0",
    "machine": "arm64",
    "python": "3.15.0",
    "executor_sha256": "a96a139174041ae8dfe7963efb7acd8c1ff59a39e1f8a5bd857f76274fc65660"
  },
  "input_sha256": "2ad9b797416494ddce05c55ebc40addfcdf8436255f0ab216b76701f43111ecc",
  "rounds": [
    {
      "phase": "inventory",
      "command": [
        "/usr/bin/find",
        ".",
        "-type",
        "f"
      ],
      "status": "ok",
      "exit_code": 0,
      "sandbox": "macOS Seatbelt",
      "diagnostic": null,
      "elapsed_seconds": 0.007729334000032395,
      "stdout": {
        "base64": "Li9DYXJnby50b21sCi4vTElDRU5TRS1BUEFDSEUKLi9ydXN0Zm10LnRvbWwKLi9SRUFETUUubWQKLi8uZ2l0aWdub3JlCi4vTElDRU5TRS1NSVQKLi9zcmMvbGliLnJzCg==",
        "sha256": "23f0c3c3eb21fbcb77adbfb03bde2f386d25bce3c125c8dd16e24c62f0669df6",
        "captured_bytes": 97,
        "observed_bytes": 97,
        "truncated": false
      },
      "stderr": {
        "base64": "",
        "sha256": "e3b0c44298fc1c149afbf4c8996fb92427ae41e4649b934ca495991b7852b855",
        "captured_bytes": 0,
        "observed_bytes": 0,
        "truncated": false
      }
    },
    {
      "phase": "selective_reading",
      "command": [
        "/usr/bin/grep",
        "-R",
        "-n",
        "-I",
        "-i",
        "-m",
        "3",
        "-C",
        "3",
        "-E",
        "--include=*.rs",
        "--include=*.ts",
        "--include=*.tsx",
        "--include=*.js",
        "--include=*.jsx",
        "--include=*.py",
        "--include=*.go",
        "--exclude-dir=.git",
        "Sem|alterar|código|identifique|compilar|sem|std|tipos|passam|vir|alloc",
        "."
      ],
      "status": "ok",
      "exit_code": 0,
      "sandbox": "macOS Seatbelt",
      "diagnostic": null,
      "elapsed_seconds": 0.00787470799696166,
      "stdout": {
        "base64": "Li9zcmMvbGliLnJzLTgtLy8hCi4vc3JjL2xpYi5ycy05LS8vISBbcG9zaXgtc2hlbGxdOiBodHRwOi8vcHVicy5vcGVuZ3JvdXAub3JnL29ubGluZXB1YnMvOTY5OTkxOTc5OS91dGlsaXRpZXMvVjNfY2hhcDAyLmh0bWwKLi9zcmMvbGliLnJzLTEwLQouL3NyYy9saWIucnM6MTE6IyFbY2ZnX2F0dHIobm90KGZlYXR1cmUgPSAic3RkIiksIG5vX3N0ZCldCi4vc3JjL2xpYi5ycy0xMi0jIVtmb3JiaWQodW5zYWZlX2NvZGUpXQouL3NyYy9saWIucnMtMTMtCi4vc3JjL2xpYi5yczoxNDojW2NmZyhmZWF0dXJlID0gInN0ZCIpXQouL3NyYy9saWIucnMtMTUtZXh0ZXJuIGNyYXRlIGNvcmU7Ci4vc3JjL2xpYi5ycy0xNi0KLi9zcmMvbGliLnJzLTE3LXVzZSBjb3JlOjpmbXQ7Ci4vc3JjL2xpYi5ycy0xOC11c2UgY29yZTo6bWVtOwouL3NyYy9saWIucnMtMTktCi4vc3JjL2xpYi5yczoyMDojW2NmZyhub3QoZmVhdHVyZSA9ICJzdGQiKSldCi4vc3JjL2xpYi5ycy0yMS0jW21hY3JvX3VzZV0KLi9zcmMvbGliLnJzLTIyLWV4dGVybiBjcmF0ZSBhbGxvYzsKLi9zcmMvbGliLnJzLTIzLQo=",
        "sha256": "d12f78a2e2e357cdaa5d9be17b99b1c76e7a586c78172bc478fac1d9fcc9f7ce",
        "captured_bytes": 557,
        "observed_bytes": 557,
        "truncated": false
      },
      "stderr": {
        "base64": "",
        "sha256": "e3b0c44298fc1c149afbf4c8996fb92427ae41e4649b934ca495991b7852b855",
        "captured_bytes": 0,
        "observed_bytes": 0,
        "truncated": false
      }
    }
  ],
  "measurement": {
    "captured_bytes": 654,
    "model_tokens": null
  },
  "limitations": [
    "scripted retrieval; no agent success or competitive advantage measured",
    "no model tokenizer configured; token counts and model costs unknown"
  ],
  "transcript_sha256": "02509e624838ceab244f079fe66bdd4d92b8de168cdd128ac0112bc17a8e5912",
  "workspace_sha256": "476f5598a61aa647bbb35ca9ca66cc1bfbfa5fc4f2e3b121f292ff30dc6a9793"
}
